"","k","top"
"1",1,"дань острове васильевском народные уважения руси блины гулянья масленицы песнями зимы гуляния масленица алисы весны стиле народными блинами устроят скоморохи"
"2",2,"br пути любви поиске человека собой творческого самим творческом расскажет история судьбой стефана цвейга её нова непростой письмо котором человеке"
"3",3,"kudago href spb place https http театра concerts event сцене mariinsky rock mihajlovskij-teatr михайловского биржа birzha-bar петербургского новой шоу erarta"
"4",4,"исполнении композиторов прозвучат песни произведения музыка разных русских программе театра сочинения исполнят также композиции артистов шедевры прозвучит музыку эпох барокко"
"5",5,"кино фильмов фильмы языке фестиваля будут фестиваль лучшие покажут фестивале лучших работы которые фильм короткометражных рамках режиссеров субтитрами россии мира"
"6",6,"дети смогут гости узнают участники зрители увидят будут познакомятся маленькие вместе юные ребята станут также героями посетители самые взрослые отправятся"
"7",7,"пор сих тех мастерской квartира творческой ксения джо жени каких творческая любич этаж петербургской государства соколов брауна тысячи споры мастерская"
"8",8,"история любви комедия жизни постановка спектакль женщины постановке которой которая самая сказка это дружбе любовь роли пьеса юмора драма женщин"
"9",9,"мир путешествие атмосферу окунуться времени погрузиться приглашают приглашает пространство прошлое совершить увлекательное погружение историю весь отправиться будущее предлагает вместе реальность"
"10",10,"клубе сцене концерт клуба группа группы зал выступит ожидания состоится клуб ноября декабря выступят mod космонавт октября даст большой jagger"
"11",11,"жизни человека своем новом творчестве своих своём темы людей проекте общества окружающей художница времени образ среде современного форм обращается мира"
"12",12,"успех впервые вход свободный прибудет совместно художественным руководителем партия свежая реставрации guitar россию название страну процесс проспекту специальный дебютная ad"
"13",13,"петербурга города путешествие город экскурсии музеев истории экскурсия время ночь петербург неве тайны санкт-петербурга места экскурсию сможете узнать увидите прогулки"
"14",14,"приобрести вещи руками ярмарка подарки вещей украшения своими работы ярмарке которые одежды изделия игрушки также подарков дизайнеров ручной аксессуары найти"
"15",15,"станет является году одним который стал главным самым стала мире стали называют которого событием традицией частью считается первым первых которой"
"16",16,"билеты рублей цене вместо скидкой посетить приобрести упустите компания акции билет горбилет получить можете билетов скидка действует полцены купить предложение"
"17",17,"расскажет моды лекция известный истории лекцию стиля лекции историк проведет автор поделится лев проведёт лекций писатель лурье тему музыковед искусства"
"18",18,"фестиваль пройдет день петербурге который года праздник состоится города будут пройдёт санкт-петербурге мая году сентября июня первый августа которого международный"
"19",19,"оставит оперетта чуковского финский имре добра равнодушными кальмана равнодушным оперетты корнея шведской никого света астрид линдгрен hot венгерского легара княгини"
"20",20,"художник александр петербургский известный россии сергей артист мастер юрий первую владимир режиссер свои народный дмитрий очередь николай евгений молодой игорь"
"21",21,"пола прекрасного роль свободном представительниц главных играет пространстве паруса ролях дорога алые дамы джеймс прямая войну второе сыграли февраля тони"
"22",22,"премии конкурсов международных лауреат золотой года конкурса обладатель маски золотая лауреаты россии премий лучший лауреата молодой премию лауреатов имени маска"
"23",23,"работы выставка художников художника искусства произведения работ представляет проект живописи петербургского выставки мастера современных выставке фотографии картины представлены известного экспозиция"
"24",24,"блюда кухни готовить кофе мастер-класс блюд ресторан меню попробовать ресторане ресторана гостей отведать кафе вкусно ресторанный кухня шеф-повар ресторанов вкусные"
"25",25,"самых одного одной лучших петербурга одна известных молодых российских ярких россии одно популярных ведущих одном музыкантов коллективов двух групп музыкальных"
"26",26,"братьев война андерсена ганса вторая гримм христиана мартина макдонаха часть отечественная первая раньше стране против нино великая кристиана мировая первым"
"27",27,"выставка пройдет рамках состоится встреча посвященная международная октября первая россии санкт-петербурге дворце проекта апреля посвящена моды года которая очередная марта"
"28",28,"детей спектакль сказки родителей зрителей взрослых маленьких лет юных детский сказка представление детям театр сказок дом мир приключения приглашает герои"
"29",29,"книги небом открытым стихи вечер книг анны библиотеке встреча имени ахматовой творческий библиотека бродского стихов буквоеде литературы арт-кафе библиотеки чтения"
"30",30,"квест предстоит реальности пройти приключений квеста приключения игры разгадать выбраться приключение спасти участникам предлагает команда загадки квесте компания квестов гарри"
"31",31,"снимки фотографии фотограф журнала фотографий фотографов фото память фотография издания снимков журнал снимках запечатлеть фотографы фотосессии съемки расскажет сделать журналов"
"32",32,"жизни образа радуга трк здорового питер house питерлэнд трц торгово-развлекательном посетителей fitness континент центр сеть комплекса галерея приятное комплексе спорта"
"33",33,"великой войны истории отечественной победы мировой ленинграда войне время первой блокады советского события экспозиция революции выставка военных событий рассказывает годы"
"34",34,"спектакль театра постановка пьесе постановке александра мотивам драматурга пьесы режиссера премьера спектакля театр представляет режиссёр пьеса произведений режиссёра основу владимира"
"35",35,"полной настроение отличное руки которые мере энергии сил свидания спектр полный ощущений будней помогут компания знакомств воедино вверх эмоций новых"
"36",36,"слушателей пикколо пространстве миром музыкальных лет детей который юных музыка маленьких очередной познакомить возраст музыкальный музыкального самых программа проектом цикла"
"37",37,"вне дк карло льюиса рамок чудес кэрролла имени селе ленсовета стране границ зависимости представлений объединение газа гольдони царском гоцци полна"
"38",38,"шоу событие представление это мероприятие яркое музыкальное самое грандиозное которое действо новое ожидает формате зрителей ждет уникальное праздничное масштабное необычное"
"39",39,"фестиваля рамках международного конкурса участников проекта музыкального музыкальная выступление сезона мирового уровня пройдет серии весна состоится тура концерт посвященного форума"
"40",40,"вопросы ответы другие вопрос многие ответ ответит какие ответить найти почему человека темы узнаете такое pink важные проблемы каким floyd"
"41",41,"недорого испытать всё наличии адреналина купона почувствовать отдых активный town это полёт коньках удовольствия покататься обойдётся купон rock бесплатного ловкость"
"42",42,"программу представит новую публике представляет представят концертную представляют музыкальную книгу зрителям праздничную посвящённую которой коллектив которую вошли большую петербургской специальную"
"43",43,"годы история воспоминания советском которая последние предков союзе долгие хранит 90-е наших хранят поколения вид бережно музей многие связь первые"
"44",44,"столицу северную петербург культурную посетит город приезжает полноценный париж едет московский мыльных расширяет стажем пузырей везёт мыльные пузыри дорог гастролями"
"45",45,"века xx прошлого xix годов начала столетия веков эпохи хх xviii веке конца первой истории начале второй времена середины xxi"
"46",46,"песни хиты новые лучшие свои композиции группы исполнит любимые концерте представит самые известные старые группа коллектива грани песен альбома своего"
"47",47,"искусство советских это новые картины музее художника игровых художники автоматов связи современное творчества творческом инсталляции современным работы проекта художницы истории"
"48",48,"fish fabrique da сцене клуба пространство музыканты nouvelle выступят клубе гостями культового манхэттен настроения наполнит концертом вибрациями коллектив сыграют качестве"
"49",49,"ждут мастер-классы гостей также игры ждет лекции пройдут встречи конкурсы ждёт выступления детей другие танцы игр увлекательные всей посетителей фестивале"
"50",50,"взглянуть markscheider kunst по-новому глаза системы зрителям действительность игра мир александры власти которой слов предлагает солнечной помощи героям слова ассоциации"
"51",51,"петербург em россию альбома невы рамках берегов возвращаются нового тура новым новой вновь альбомом россии рока возвращается впервые санкт-петербург турне"
"52",52,"это каждый тех хотите сделать стать приходите которые свой научиться создать сможет нужно сможете узнать свои просто время мастер-класс ваш"
"53",53,"пространство высоты птичьего полёта арт-группы станции князя метро гагарина полета тихие ткачи юрия город космос снежная человеческими разговоры кэти название"
"54",54,"начиная заканчивая направлении лицом фильму орден года бой достоинству красный обретет лис основатель государство ради оценены саундтрека эмоционального специально специалистом"
"55",55,"день рождения юбилей свой отмечает году празднует отметит концертом отметят деятельности своего творческой большим группа отметить отмечают коллег компании свое"
"56",56,"фильм виктора главного роману цоя году известной драма бориса король года песен героя английской создал геннадия французским фриды кало всемирно"
"57",57,"расскажут семинар бизнеса компании сфере развития области специалистов компаний расскажет бизнес работы секреты технологий также индустрии технологии форум специалисты семинаре"
"58",58,"день святого валентина февраля влюбленных подарок марта влюблённых праздник отечества защитника любви любовь друг мужчин дню прекрасных женский подарком ко"
"59",59,"средства детей помочь благотворительный фонда помощь возможностями детям благотворительной ограниченными благотворительного поддержку будут advita пойдут людям фонд акции дело средств"
"60",60,"свои выступят музыканты представят молодые самые артисты сцене известные соберутся лучшие молодых коллективы яркие певцов сцену оперных петербургские академии российские"
"61",61,"оркестра исполнении музыка программе произведения прозвучит театра оркестр мариинского симфонического композитора прозвучат чайковского исполнит сергея управлением концерт моцарта баха руководством"
"62",62,"коллекция искусства музея которые истории включает предметы коллекции музее экспонаты произведений музей увидеть выставки также эрмитажа около выставке входят экспозиция"
"63",63,"публику своим своими слушателей порадует новыми песнями поклонников музыкой своей зрителей своих петербургскую порадуют поделиться яркими познакомит радовать поделится ночей"
"64",64,"кино фильма фильмов фильм покажут cinema фильмы показ кинотеатре большом экране кинематографа ночь режиссера картины аврора родина кинотеатр зрителей посмотреть"
"65",65,"певица её финского ольга актриса россии артистка выступит известная залива татьяна петербургская мария елена ирина вокалистка светлана народная марины русская"
"66",66,"это которые которых жизни который именно время просто место которая люди всё каждый людей всем очень которой своей мир человека"
"67",67,"новый альбом свой проект представит группа презентует сезон который публике представить представляет новую публики работу дебютный представят концертный качестве петербурге"
"68",68,"концерт группы нового альбома большой выступление рока презентация команды российской проекта русского сольный коллектива петербурге первый питерской героев питерского вечер"
"69",69,"академии художеств студентов студенты университета театральной искусств российской имени наук санкт-петербургского штиглица музея государственного завода императорского санкт-петербургской которая времени вузов"
"70",70,"возможность смогут увидеть посетить познакомиться услышать strong гости бесплатно узнать могут уникальная желающие приглашаются послушать посмотреть посетители шанс любители также"
"71",71,"театра проект танца постановка перформанс театр спектакль представляет жанре постановки сцене спектакля хореографии хореографа искусства эксперимент современной современного котором скороход"
"72",72,"миру всему сердца благодаря своей количество стиль стиля которая музыка огромное миллионов уникальным зрителей внимание известность который чьи большое жанре"
"73",73,"лейбла именем мировым выступит британский вечеринке диджей deep dj продюсер black star ритмов records ломаных aka станет soul пластинок purple"
"74",74,"джаза band вечер исполнении джазовой трио jazz ансамбля пианиста петербургского петербургской джазовые музыкантов музыки классики ансамбль андрея jfc вокалистки джазовых"
"75",75,"театра сцене балета музыку балет театр опера оперы петра имени спектакль чайковского постановке премьера постановки представляет театров мариинского композитора покажут"
"76",76,"россии разных страны стран мира культуры народов других нашей европы италии франции стране историей германии культуре культурой сша городов также"
"77",77,"utm strong target class rel nofollow blank http external-link href ru www kudago source spb campaign medium ref megakupon deal"
"78",78,"искусства современного эрарта музее выставку музей выставка пройдет art состоится октября ноября музея апреля представляет вниманию зале звука галерея проект"
"79",79,"острове парке небо праздника елагином цветы воздушные парк сад фонариков тысячи воздушных запуск бабушкина волшебные самого сны фигуры сказок город"
"80",80,"приглашает получить открытых центр школа занятия языка желающих добро хотите пожаловать курс дверей знания школы курсы английский школе английского сможете"
"81",81,"главный герой дали момент вклад мировую достоевский сальвадора развитие рене удивительный начало де доктор черная серий приз создание фёдор михайлович"
"82",82,"обороты набирает популярность стремительно уверенно говоря островов soundbar banka итогов жизненной набирающий название виде играют ice норвежской набирающего вечеринку простые"
"83",83,"многое другое это эмоций впечатления music подарит fest впечатлений яркие roof новые незабываемые ярких цветов море красок ждёт фестивале новых"
