"","k","top"
"84",84,"моря фестиваль проходит самый ежегодно год тысяч городке приезжают каждый городе отправляются музыкальный финляндии бороться берегу mundo крупнейших небольшом побережья"
"85",85,"время приглашает провести год компании новый праздник ночь это года вечер вместе день нового друзей ещё весело атмосфере выходные возможность"
"86",86,"шоу club comedy red made hand юмора stand-up open mic проекту юмористического радио резидентов формат шуток os вечером юмор alina"
"87",87,"животных собак пород выставке соревнования выставка кошек кошки других разных животными этих собаки представителями пройдут среди любителей выставки домашних зоопарк"
"88",88,"музыки вечер концерт зале рамках филармонии цикла музыке русской классической концертов музыкальной продолжает музыкальный цикл современной посвященный состоится программы концертном"
"89",89,"друг почему друга название творчество свет образом другом искусство имя время влияние цвет цвета такое каким людей новое разных многом"
"90",90,"северной столицы столице города культурной петербурга самом сердце центре главной жителей гостей площадки родного жителям жизни также санкт-петербурга петербуржцев клубной"
"91",91,"программой выступит новой музыкант своей петербурге автор исполнитель певец сольной известный поклонникам российской александр песен композитор звезда эстрады легендарный популярный"
"92",92,"лет назад несколько году года дней протяжении двух последних пять две ночи спустя четыре течение исполняется последние десятков сразу наших"
"93",93,"танец ритмы музыка танца танцев dance танго тела танцы танцоров зажигательные музыку танцевать движения стиле страсти движение чувства мастер-класс мастерство"
"94",94,"выступит сцене джаз музыки пианист джазовой филармонии гитарист коллектив андрей петербургской вместе алексей американский саксофонист знаменитый джазовый джаза известный трио"
"95",95,"вечеринка клубе ночь dj клуба состоится баре вечеринку party вечеринки участием estrada ноября диджеев вечеринке субботу пятницу вечеринок бар пройдет"
"96",96,"участие принять примут этажи лофт проекте проект мастер-классах также принимают примет проекта сможете котором приглашает могут поучаствовать фестивале программе пройдёт"
"97",97,"дня рождения честь дню году концерт посвящена великого праздника юбилею посвящается самого случаю юбилея поэта российского ко памяти александра праздничный"
"98",98,"программа новая концертная праздничная большая саду яркая специальная посвящена которой музыкальная включает обширная которую ботаническом т огромным называется дома состоит"
"99",99,"музыки вечер инструментов музыка электронной рок музыкальных любителей живой стилей группы звуки вечера современной звучание ценителей жанров rock сочетание исполнении"
"100",100,"маша анри медведи станет море матисс макарова утро yoga марселя ивана прекрасным обаяния французских матисса королей моне поль марко йоги"
